{
  "id": "L3-check-declared-port-covers-port",
  "level": 3,
  "kind": "check",
  "description": "...and covers one that writes that port",
  "spec": [
    "9.5"
  ],
  "from": "check_ratchet.py CHECKS declared-port-covers-port",
  "requires": [],
  "known_limit": null,
  "input": {
    "tree": {
      "poll.vel": "fn ping() -> Int uses net or fail {\n    return try fetch_status(\"https://api.example.com/ping\")\n}\n\nfn main() uses io, net {\n    for i in 0 to 3 {\n        check ping() {\n            ok code {\n                print(to_text(code))\n            }\n            fail why {\n                print(why)\n            }\n        }\n    }\n}\n"
    },
    "root": ".",
    "baseline": {
      "from_tree": true,
      "edit": {
        "surface": {
          "grants": [
            "io",
            "net:api.example.com:443"
          ]
        },
        "programs": {
          "poll.vel": {
            "grants": [
              "io",
              "net:api.example.com:443"
            ]
          }
        }
      }
    },
    "change": {
      "poll.vel": "fn ping() -> Int uses net or fail {\n    return try fetch_status(\"https://api.example.com:443/ping\")\n}\n\nfn main() uses io, net {\n    for i in 0 to 3 {\n        check ping() {\n            ok code {\n                print(to_text(code))\n            }\n            fail why {\n                print(why)\n            }\n        }\n    }\n}\n"
    }
  },
  "expect": {
    "verdict": "pass",
    "widenings": []
  }
}
