{
  "id": "L1-audit-unknown-effect-name",
  "level": 1,
  "kind": "audit",
  "description": "a uses clause naming anything but the seven is refused (E300); the audit that reports it still lists only the seven, and its safe_command still parses",
  "spec": [
    "3.2",
    "8"
  ],
  "from": "check_library.py AUDITS unknown-effect-name",
  "requires": [],
  "known_limit": null,
  "input": {
    "files": {
      "main.vel": "fn main() uses io, teleport {\n    print(\"x\")\n}\n"
    },
    "entry": "main.vel"
  },
  "expect": {
    "ok": false,
    "problems_include": [
      "E300"
    ]
  }
}
