{
  "id": "L3-check-recursion-has-no-bound",
  "level": 3,
  "kind": "check",
  "description": "recursion has no bound either",
  "spec": [
    "9.4"
  ],
  "from": "check_ratchet.py CHECKS recursion-has-no-bound",
  "requires": [],
  "known_limit": null,
  "input": {
    "tree": {
      "poll.vel": "fn ping() -> Int uses net or fail {\n    return try fetch_status(\"https://api.example.com/ping\")\n}\n\nfn main() uses io, net {\n    for i in 0 to 3 {\n        check ping() {\n            ok code {\n                print(to_text(code))\n            }\n            fail why {\n                print(why)\n            }\n        }\n    }\n}\n"
    },
    "root": ".",
    "baseline": {
      "from_tree": true,
      "edit": null
    },
    "change": {
      "poll.vel": "fn poll(n: Int) -> Int uses net {\n    if n <= 0 {\n        return 0\n    }\n    check fetch_status(\"https://api.example.com\") {\n        ok s {\n            return poll(n - 1)\n        }\n        fail why {\n            return 0\n        }\n    }\n}\n\nfn main() uses io, net {\n    print(to_text(poll(5)))\n}\n"
    }
  },
  "expect": {
    "verdict": "widened",
    "widenings": [
      {
        "kind": "count",
        "effect": "net",
        "program": "poll.vel",
        "current": null,
        "rules": [
          "W2",
          "W4"
        ]
      }
    ]
  }
}
