{
  "id": "L1-audit-path-with-comma",
  "level": 1,
  "kind": "audit",
  "description": "a comma in a literal path is percent-encoded in safe_command, so it parses back",
  "spec": [
    "3.2",
    "8"
  ],
  "from": "check_library.py AUDITS path-with-comma",
  "requires": [],
  "known_limit": null,
  "input": {
    "files": {
      "main.vel": "fn main() uses io, fs {\n    check read_file(\"data,cache.txt\") {\n        ok t {\n            print(t)\n        }\n        fail w {\n            print(w)\n        }\n    }\n}\n"
    },
    "entry": "main.vel"
  },
  "expect": {
    "ok": true,
    "effects": [
      "fs",
      "io"
    ],
    "functions": [
      {
        "name": "main",
        "effects": [
          "fs",
          "io"
        ],
        "can_fail": false
      }
    ],
    "ffi_modules": [],
    "ffi_any": false,
    "fs_paths": {
      "read": [
        "data,cache.txt"
      ],
      "write": [],
      "read_any": false,
      "write_any": false
    },
    "net_hosts": {
      "hosts": [],
      "any": false
    },
    "safe_command": "sabline <file> --allow fs:read:data%2Ccache.txt,io"
  }
}
