{
  "id": "L3-check-baseline-count-in-grant",
  "level": 3,
  "kind": "check",
  "description": "a baseline holding a count in a grant cannot be compared",
  "spec": [
    "9.2",
    "9.6"
  ],
  "from": "check_ratchet.py CHECKS baseline-count-in-grant",
  "requires": [],
  "known_limit": null,
  "input": {
    "tree": {
      "poll.vel": "fn ping() -> Int uses net or fail {\n    return try fetch_status(\"https://api.example.com/ping\")\n}\n\nfn main() uses io, net {\n    for i in 0 to 3 {\n        check ping() {\n            ok code {\n                print(to_text(code))\n            }\n            fail why {\n                print(why)\n            }\n        }\n    }\n}\n"
    },
    "root": ".",
    "baseline": {
      "text": "{\"schema\": \"sabline.capabilities/1\", \"sabline_version\": \"4.1.0\", \"date\": \"2026-09-11\", \"surface\": {\"grants\": [\"net:h.example@3\"], \"counts\": {}}, \"programs\": []}\n"
    },
    "change": {}
  },
  "expect": {
    "verdict": "cannot-compare"
  }
}
