{
  "id": "L2-deny-one",
  "level": 2,
  "kind": "run",
  "description": "denying one effect while allowing the rest",
  "spec": [
    "4.4",
    "6 G2"
  ],
  "from": "check_sandbox.py ESCAPES deny-one",
  "requires": [],
  "known_limit": null,
  "input": {
    "fixture": "sandbox",
    "source": "fn main() uses io, fs {\n    write_file(\"{ROOT}/wrote.txt\", \"escaped\")\n    print(\"WROTE IT\")\n}\n",
    "allow": "io,fs",
    "deny": "fs",
    "args": []
  },
  "expect": {
    "outcome": "refused",
    "code": "E310",
    "stdout_includes": [],
    "stdout_excludes": [
      "READ IT",
      "WROTE IT",
      "REACHED IT",
      "CALLED IT",
      "OPENED IT",
      "GOT THROUGH",
      "CARRIED ON",
      "SWALLOWED THE REFUSAL",
      "FOLLOWED IT"
    ],
    "must_not_exist": [
      "{ROOT}/wrote.txt"
    ]
  }
}
