{
  "id": "L1-budget-host-wildcard",
  "level": 1,
  "kind": "budget",
  "description": "a wildcard over one label",
  "spec": [
    "4",
    "5"
  ],
  "from": "check_library.py BUDGETS host-wildcard",
  "requires": [],
  "known_limit": null,
  "input": {
    "allow": "net:*.example.com"
  },
  "expect": {
    "valid": true,
    "grants": {
      "effects": [
        "net"
      ],
      "net": [
        {
          "host": "*.example.com",
          "port": null
        }
      ],
      "counts": {}
    }
  }
}
