{
  "id": "L3-bound-counter-changed-by-loop",
  "level": 3,
  "kind": "bound",
  "description": "a counter that a loop body changes is not a fixed start",
  "spec": [
    "9.4"
  ],
  "from": "check_ratchet.py BOUNDS counter-changed-by-loop",
  "requires": [],
  "known_limit": null,
  "input": {
    "source": "fn main() uses fs {\n    let i = 0\n    while i < 3 {\n        i = i + 1\n    }\n    while i < 5 {\n        let e = file_exists(\"x\")\n        i = i + 1\n    }\n}\n",
    "function": "main"
  },
  "expect": {
    "fs": null,
    "net": 0
  }
}
